{
  "$schema": "https://json-schema.org/draft/2020-12/schema",
  "title": "M11 abstract private qualification",
  "type": "object", "additionalProperties": false,
  "required": ["schema_version", "child_commit", "vaeg_commit", "artifact_manifest", "fresh_prerequisite", "main_runs", "control_runs", "two_main_runs_equal", "two_control_runs_equal", "actual_schema_instances_valid", "production_memory_trace", "private_execution_in_public_ci", "hardware_run", "evidence_retention"],
  "properties": {
    "schema_version": {"const": 1}, "child_commit": {"const": "b08ace36670a05992d8ddaa4279727d9b17bd11e"}, "vaeg_commit": {"const": "7dd453cbd36014ba453a26765b00cd0cc9a99655"},
    "artifact_manifest": {"type": "object", "additionalProperties": false, "required": ["path", "sha256"], "properties": {"path": {"const": "qa/golden/m11/manifest.json"}, "sha256": {"type": "string", "pattern": "^[0-9a-f]{64}$"}}},
    "fresh_prerequisite": {"const": "M11 FRESH PREREQUISITE PASS"},
    "main_runs": {"type": "array", "minItems": 2, "maxItems": 2, "items": {"type": "object", "additionalProperties": false, "required": ["boundaries", "inputs_preserved", "projection_equal"], "properties": {"boundaries": {"const": ["K0", "K1", "K2", "K3", "K4", "K5", "K6", "K7", "K8", "K9"]}, "inputs_preserved": {"const": true}, "projection_equal": {"const": true}}}},
    "control_runs": {"type": "array", "minItems": 2, "maxItems": 2, "items": {"type": "object", "additionalProperties": false, "required": ["boundaries", "inputs_preserved", "projection_equal"], "properties": {"boundaries": {"const": ["N0", "N1", "N2", "N3", "N4"]}, "inputs_preserved": {"const": true}, "projection_equal": {"const": true}}}},
    "two_main_runs_equal": {"const": true}, "two_control_runs_equal": {"const": true}, "actual_schema_instances_valid": {"const": true}, "production_memory_trace": {"const": true}, "private_execution_in_public_ci": {"const": false}, "hardware_run": {"const": false}, "evidence_retention": {"const": "persistent_ignored"}
  }
}
